{
  "$schema": "https://json-schema.org/draft/2020-12/schema",
  "$id": "https://agentic-hub.local/schemas/account.schema.json",
  "title": "Agentic Hub Account",
  "type": "object",
  "additionalProperties": false,
  "required": [
    "id",
    "name",
    "website",
    "segment",
    "source",
    "status",
    "fit_score",
    "confidence",
    "created_at",
    "updated_at"
  ],
  "properties": {
    "id": {
      "type": "string",
      "pattern": "^acct_[a-z0-9_]+$"
    },
    "name": {
      "type": "string",
      "minLength": 1
    },
    "website": {
      "type": "string",
      "minLength": 1
    },
    "segment": {
      "type": "string",
      "minLength": 1
    },
    "source": {
      "type": "string",
      "minLength": 1
    },
    "notes": {
      "type": "string"
    },
    "status": {
      "type": "string",
      "enum": [
        "new",
        "researching",
        "needs_review",
        "approved",
        "rejected",
        "needs_more_info"
      ]
    },
    "fit_score": {
      "type": "integer",
      "minimum": 0,
      "maximum": 100
    },
    "score_breakdown": {
      "type": "object",
      "additionalProperties": {
        "type": "integer",
        "minimum": 0,
        "maximum": 100
      }
    },
    "confidence": {
      "type": "string",
      "enum": [
        "low",
        "medium",
        "high"
      ]
    },
    "missing_information": {
      "type": "array",
      "items": {
        "type": "string"
      }
    },
    "disqualifiers": {
      "type": "array",
      "items": {
        "type": "string"
      }
    },
    "suggested_angle": {
      "type": "string"
    },
    "recommended_next_action": {
      "type": "string"
    },
    "created_at": {
      "type": "string",
      "format": "date-time"
    },
    "updated_at": {
      "type": "string",
      "format": "date-time"
    }
  }
}
