[
  {
    "id": "acct_northstar_ops_studio",
    "name": "Northstar Ops Studio",
    "website": "https://northstar-ops.example",
    "segment": "solo_consultant",
    "source": "demo fixture",
    "notes": "Founder sells RevOps retainers, tracks leads in spreadsheets, misses follow-ups after discovery calls, wants more evidence-backed personalization.",
    "status": "needs_review",
    "fit_score": 86,
    "score_breakdown": {
      "icp_match": 30,
      "pain_signal": 12,
      "ability_to_pay": 15,
      "reachable_context": 15,
      "timing_signal": 4,
      "strategic_relevance": 10
    },
    "confidence": "high",
    "missing_information": [
      "Named buyer or decision-maker",
      "Recent public proof beyond operator notes"
    ],
    "disqualifiers": [],
    "suggested_angle": "Lead with evidence-backed lead briefs and review-gated drafts for solo consultant operators.",
    "recommended_next_action": "Review the lead brief, confirm the buyer/contact, then edit or approve the draft manually.",
    "created_at": "2026-06-11T22:30:00.000Z",
    "updated_at": "2026-06-11T22:30:00.000Z"
  },
  {
    "id": "acct_brightlane_creative",
    "name": "Brightlane Creative",
    "website": "https://brightlane.example",
    "segment": "boutique_agency",
    "source": "demo fixture",
    "notes": "Eight-person web agency with project-based leads, inconsistent follow-up process, no analytics on referral source quality.",
    "status": "needs_review",
    "fit_score": 82,
    "score_breakdown": {
      "icp_match": 28,
      "pain_signal": 12,
      "ability_to_pay": 15,
      "reachable_context": 15,
      "timing_signal": 2,
      "strategic_relevance": 10
    },
    "confidence": "high",
    "missing_information": [
      "Named buyer or decision-maker",
      "Recent public proof beyond operator notes"
    ],
    "disqualifiers": [],
    "suggested_angle": "Lead with a local pipeline sprint for boutique agency teams that connects research quality, follow-up review, and weekly analytics.",
    "recommended_next_action": "Review the lead brief, confirm the buyer/contact, then edit or approve the draft manually.",
    "created_at": "2026-06-11T22:30:00.000Z",
    "updated_at": "2026-06-11T22:30:00.000Z"
  },
  {
    "id": "acct_atlas_founder_labs",
    "name": "Atlas Founder Labs",
    "website": "https://atlas-founder-labs.example",
    "segment": "founder_led_b2b",
    "source": "demo fixture",
    "notes": "Early B2B SaaS team doing founder-led sales, many demo notes in docs, needs context-aware investor and prospect follow-ups.",
    "status": "needs_review",
    "fit_score": 86,
    "score_breakdown": {
      "icp_match": 30,
      "pain_signal": 12,
      "ability_to_pay": 15,
      "reachable_context": 15,
      "timing_signal": 4,
      "strategic_relevance": 10
    },
    "confidence": "high",
    "missing_information": [
      "Named buyer or decision-maker",
      "Recent public proof beyond operator notes"
    ],
    "disqualifiers": [],
    "suggested_angle": "Lead with evidence-backed lead briefs and review-gated drafts for founder led b2b operators.",
    "recommended_next_action": "Review the lead brief, confirm the buyer/contact, then edit or approve the draft manually.",
    "created_at": "2026-06-11T22:30:00.000Z",
    "updated_at": "2026-06-11T22:30:00.000Z"
  },
  {
    "id": "acct_cedar_grant_partners",
    "name": "Cedar Grant Partners",
    "website": "https://cedar-grants.example",
    "segment": "professional_services",
    "source": "demo fixture",
    "notes": "Grant writing consultancy with many warm relationships, deadline-driven follow-up windows, sensitive compliance language.",
    "status": "needs_review",
    "fit_score": 71,
    "score_breakdown": {
      "icp_match": 24,
      "pain_signal": 8,
      "ability_to_pay": 12,
      "reachable_context": 15,
      "timing_signal": 4,
      "strategic_relevance": 8
    },
    "confidence": "high",
    "missing_information": [
      "Named buyer or decision-maker",
      "Recent public proof beyond operator notes"
    ],
    "disqualifiers": [],
    "suggested_angle": "Lead with a human-reviewed follow-up queue for deadline-sensitive relationship workflows.",
    "recommended_next_action": "Review the lead brief, confirm the buyer/contact, then edit or approve the draft manually.",
    "created_at": "2026-06-11T22:30:00.000Z",
    "updated_at": "2026-06-11T22:30:00.000Z"
  },
  {
    "id": "acct_quickscale_outreach",
    "name": "QuickScale Outreach",
    "website": "https://quickscale-outreach.example",
    "segment": "automation_vendor",
    "source": "demo fixture",
    "notes": "Vendor advertises autonomous high-volume outbound and asks for platform automation at scale.",
    "status": "needs_review",
    "fit_score": 28,
    "score_breakdown": {
      "icp_match": 5,
      "pain_signal": 0,
      "ability_to_pay": 6,
      "reachable_context": 15,
      "timing_signal": 0,
      "strategic_relevance": 2
    },
    "confidence": "low",
    "missing_information": [
      "Named buyer or decision-maker",
      "Recent public proof beyond operator notes",
      "Follow-up trigger or current relationship context",
      "Legitimate supervised use case that does not require risky outbound automation"
    ],
    "disqualifiers": [
      "Requests autonomous or high-volume platform automation.",
      "Segment conflicts with the supervised, human-approved product boundary."
    ],
    "suggested_angle": "Do not position outreach automation. Clarify whether there is a supervised analytics or review workflow worth discussing.",
    "recommended_next_action": "Reject or clarify the use case before drafting any outreach.",
    "created_at": "2026-06-11T22:30:00.000Z",
    "updated_at": "2026-06-11T22:30:00.000Z"
  }
]
